{
  "$schema": "https://json-schema.org/draft/2020-12/schema",
  "title": "The BOINC server's committed settings, boinc/infra/boinc/env/<env>.json",
  "description": "Public settings that boinc/scripts/provision-boinc.sh deploys as the stack usnm-boinc-<env> into usnm-boinc-rg-<env>, and boinc/scripts/build-boinc-images.sh updates with the images it builds. Nothing secret belongs here: the secrets are made in Azure (boinc/infra/boinc/modules/keyvault.bicep). Keys sorted. provision-boinc.sh checks the same rules with jq.",
  "type": "object",
  "additionalProperties": false,
  "required": [
    "assessment",
    "codeSignPublicKey",
    "goldBundle",
    "images",
    "location",
    "operator",
    "projectUrl",
    "subscriptionId"
  ],
  "properties": {
    "$schema": {
      "type": "string",
      "description": "This schema, for editors: ./schema.json."
    },
    "assessment": {
      "type": "boolean",
      "description": "Run the server from the bridge image (the server image plus usnm-boinc), so the usnm_assess and usnm_gold validators can run: main.bicep's assessment parameter."
    },
    "codeSignPublicKey": {
      "type": "string",
      "description": "The PUBLIC half of the offline code-signing key (code_sign_public), as text. Empty until it is made on the offline machine. The private half never comes here or to Azure."
    },
    "goldBundle": {
      "type": "boolean",
      "description": "Deploy the gold bundle job, which builds the gold bundle v1 from its publishers onto the share inside the VNet (boinc/docs/gold-check.md#build-the-gold-bundle): main.bicep's goldBundle parameter."
    },
    "images": {
      "type": "object",
      "additionalProperties": false,
      "required": [
        "appver",
        "bridge",
        "server",
        "worker"
      ],
      "description": "Images by registry digest, or empty before the first build. server and bridge are in the app's shared registry (infra/names/<env>.json) and come from boinc/scripts/build-boinc-images.sh; with server empty, the stack deploys only the base resources. worker is the public GHCR package that volunteers pull (ADR-0019, addendum), from .github/workflows/boinc-worker.yml. appver is the last published app version (images/appver, usnm-boinc-appver), written by boinc/scripts/boinc-app-release.sh; when set, the stack keeps the publish job on it.",
      "properties": {
        "appver": {
          "type": "string",
          "pattern": "^$|^[a-z0-9.-]+\\.azurecr\\.io/usnm-boinc-appver@sha256:[0-9a-f]{64}$"
        },
        "bridge": {
          "type": "string",
          "pattern": "^$|^[a-z0-9.-]+\\.azurecr\\.io/[a-z0-9/_.-]+@sha256:[0-9a-f]{64}$"
        },
        "server": {
          "type": "string",
          "pattern": "^$|^[a-z0-9.-]+\\.azurecr\\.io/[a-z0-9/_.-]+@sha256:[0-9a-f]{64}$"
        },
        "worker": {
          "type": "string",
          "pattern": "^$|^ghcr\\.io/tgoodyear/usnm-boinc-worker@sha256:[0-9a-f]{64}$"
        },
        "web": {
          "type": "string",
          "pattern": "^$|^[a-z0-9.-]+\\.azurecr\\.io/[a-z0-9/_.-]+@sha256:[0-9a-f]{64}$",
          "description": "Optional web/daemon image override, preserving additive production images independently of lifecycle jobs. New normal builds update it to the rebuilt bridge; absent or empty uses assessment selection."
        }
      }
    },
    "keyVaultAllowedIps": {
      "type": "array",
      "items": {
        "type": "string",
        "pattern": "^(25[0-5]|2[0-4][0-9]|1?[0-9]?[0-9])(\\.(25[0-5]|2[0-4][0-9]|1?[0-9]?[0-9])){3}$"
      },
      "maxItems": 4,
      "description": "Public IPv4 addresses (the home network) the BOINC Key Vault admits on its public endpoint, behind its firewall and a policy exemption for that vault alone (#917, 20 October 2026). Empty or absent: private-only. main.bicep's keyVaultAllowedIps parameter."
    },
    "location": {
      "type": "string",
      "pattern": "^[a-z0-9]+$",
      "description": "Azure region; the resource group's own."
    },
    "onPremGroupId": {
      "type": "string",
      "pattern": "^[0-9a-f]{8}-[0-9a-f]{4}-[0-9a-f]{4}-[0-9a-f]{4}-[0-9a-f]{12}$",
      "description": "Object id of usnm-onprem-grp-<env> (the on-prem hosts' Arc identities): Key Vault Secrets User on the project vault, so the on-prem BOINC server reads the project secrets (#942). main.bicep's onPremGroupId."
    },
    "operator": {
      "type": "object",
      "additionalProperties": false,
      "required": [
        "login",
        "objectId"
      ],
      "description": "The Entra user or group that gets Key Vault Secrets Officer, Log Analytics Reader on the stack workspace, and is named as the MySQL Entra administrator in the printed step.",
      "properties": {
        "login": {
          "type": "string",
          "minLength": 1
        },
        "objectId": {
          "type": "string",
          "pattern": "^[0-9a-f]{8}-[0-9a-f]{4}-[0-9a-f]{4}-[0-9a-f]{4}-[0-9a-f]{12}$"
        }
      }
    },
    "projectShare": {
      "type": "string",
      "enum": [
        "standard",
        "copy",
        "provisioned",
        "provisioned-final"
      ],
      "description": "The project share's billing (#917): standard (pay-as-you-go StorageV2), copy (the provisioned v2 SSD share also mounted at /project-v2 to fill it), provisioned (/project is the provisioned share; the old account kept for rollback), provisioned-final (the old account removed). main.bicep's projectShare parameter; boinc/docs/server-and-apps.md, \"Moving the project share\"."
    },
    "projectUrl": {
      "type": "string",
      "enum": [
        "https://boinc.usnewsmap.com/",
        "https://boinc-dev.usnewsmap.com/"
      ],
      "description": "The BOINC master URL. Permanent once volunteers attach."
    },
    "qualityWave": {
      "type": "object",
      "additionalProperties": false,
      "required": [
        "script",
        "sha256"
      ],
      "description": "Deploy the usnm_quality wave job (usnm-boinc-quality-caj-<env>): it downloads the runner with the BOINC identity, refuses it unless its sha256 matches, and runs its eight shards. boinc/scripts/boinc-quality-campaign.py launch-corpus uploads boinc/scripts/quality_corpus_runner.py as quality/<campaign>/run_wave9-<first 12 of its sha256>.py and prints this setting when the job pins another. Absent: no job. main.bicep's qualityWaveScript and qualityWaveScriptSha256.",
      "properties": {
        "script": {
          "type": "string",
          "pattern": "^https://[a-z0-9]+\\.blob\\.core\\.windows\\.net/[a-z0-9-]+/[A-Za-z0-9/._-]+\\.py$",
          "description": "The script's blob URL, read with the BOINC identity."
        },
        "sha256": {
          "type": "string",
          "pattern": "^[0-9a-f]{64}$",
          "description": "The script's sha256; the job stops on any other."
        }
      }
    },
    "requireSecureTransport": {
      "type": "boolean",
      "default": false,
      "description": "Require verified MySQL TLS. Defaults OFF when absent. Set true only after #464 actual Azure-chain, complete copied-project migration/rollback and all-client acceptance, under #529 coordination. Forwarded by normal provisioning; no portal-only toggle."
    },
    "server": {
      "type": "string",
      "enum": [
        "azure",
        "onprem"
      ],
      "default": "azure",
      "description": "Where the BOINC server runs. onprem (#942, docs/boinc-onprem.md): main.bicep's serverOnPrem keeps only the identities, the vault the on-prem host reads, the VNet and the static site, and provision-boinc.sh checks the on-prem server at the master URL instead of starting lifecycle jobs. Default azure."
    },
    "subscriptionId": {
      "type": "string",
      "pattern": "^[0-9a-f]{8}-[0-9a-f]{4}-[0-9a-f]{4}-[0-9a-f]{4}-[0-9a-f]{12}$"
    }
  }
}
